{
  "finding_id": "AIVSS-ASI07-001",
  "risk_category": "ASI07",
  "title": "Unsigned agent-to-agent messages allow instruction relay",
  "summary": "Inter-agent messages lack authentication, enabling cross-agent propagation of malicious intent.",
  "cvss_vector": "CVSS:4.0/AV:A/AC:L/AT:N/PR:N/UI:N/VC:L/VI:H/VA:N/SC:H/SI:L/SA:N/E:P",
  "aivss_vector": "AIVSS:1.0/LC:I/CP:S/AP:L/RH:N/ES:W",
  "publicly_exposed": false,
  "automatable": true,
  "technical_impact": "total",
  "evidence": {
    "poc": true
  },
  "agent_untraceability": {
    "rationale": "Synthetic reference fact for AIVSS-ASI07-001: A retrieval test reconstructs ordered actions and principals but finds missing integrity or retention evidence.",
    "evidence_refs": [
      "fixture://AIVSS-ASI07-001/untraceability"
    ],
    "retrieval_tested": true,
    "ordered_actions_reconstructable": true,
    "affected_principals_bounded": true,
    "required_fields_complete": false,
    "integrity_protected": false,
    "retention_verified": false
  },
  "path_id": "AIVSS-ASI07-001-PATH-1",
  "agentic_applicability": {
    "model_directed_goal_pursuit": true,
    "action_selection_or_sequencing": true,
    "rationale": "The synthetic fixture uses a model to pursue a delegated goal and select or sequence actions that affect its environment.",
    "evidence_refs": [
      "fixture://AIVSS-ASI07-001/agentic-applicability"
    ]
  },
  "publicly_exposed_source": "synthetic deployment inventory fixture",
  "decision_data_observed_at": "2026-08-27T00:00:00Z",
  "metric_evidence": {
    "LC": {
      "rationale": "Synthetic reference fact for AIVSS-ASI07-001: Attacker-controlled language enters through retrieved or ingested content (documents, web pages, email, files) and influences security-relevant behaviour.",
      "evidence_refs": [
        "fixture://AIVSS-ASI07-001/lc"
      ]
    },
    "CP": {
      "rationale": "Synthetic reference fact for AIVSS-ASI07-001: Attacker-controlled context persists only in ephemeral session state (conversation buffer, in-memory working context, session-scoped cache), and testing confirms it is unreachable after the session boundary.",
      "evidence_refs": [
        "fixture://AIVSS-ASI07-001/cp"
      ]
    },
    "AP": {
      "rationale": "Synthetic reference fact for AIVSS-ASI07-001: Compromised intent or authority crosses a trust boundary into another agent, tenant, principal or policy domain. Impact on downstream systems is scored in CVSS SC/SI/SA, not here.",
      "evidence_refs": [
        "fixture://AIVSS-ASI07-001/ap"
      ]
    },
    "RH": {
      "rationale": "Synthetic reference fact for AIVSS-ASI07-001: Every evaluator, verifier and reward channel on the path sits outside the agent's reach (write-protected or in a separate trust domain), and a test confirms the isolation.",
      "evidence_refs": [
        "fixture://AIVSS-ASI07-001/rh"
      ],
      "reachable_proxy": false,
      "isolation_verified": true,
      "verified_episodes": null,
      "episodes_reviewed": null,
      "locus": null
    },
    "ES": {
      "rationale": "Synthetic reference fact for AIVSS-ASI07-001: A reachable tool, MCP server, skill or plugin is dynamic or unvetted, or its identity, callable operations, arguments or credentials are not independently constrained on the assessed path.",
      "evidence_refs": [
        "fixture://AIVSS-ASI07-001/es"
      ]
    }
  },
  "include_decision": true,
  "include_priority": false,
  "provenance": {
    "assessor": "synthetic-reference-fixture",
    "assessor_kind": "imported",
    "tool": "aivss-calc",
    "tool_version": "1.2.0",
    "assessed_at": "2026-08-27T00:00:00Z"
  }
}
