{
  "finding_id": "AIVSS-ASI01-001",
  "risk_category": "ASI01",
  "title": "Direct prompt injection hijacks planning agent goals",
  "summary": "Attacker-supplied instructions override the agent's intended goals via a language-mediated control path.",
  "cvss_vector": "CVSS:4.0/AV:N/AC:L/AT:N/PR:N/UI:N/VC:H/VI:H/VA:N/SC:H/SI:L/SA:N/E:P",
  "aivss_vector": "AIVSS:1.0/LC:D/CP:S/AP:C/RH:N/ES:M",
  "publicly_exposed": true,
  "automatable": true,
  "technical_impact": "total",
  "evidence": {
    "poc": true
  },
  "agent_untraceability": {
    "rationale": "Synthetic reference fact for AIVSS-ASI01-001: A retrieval test reconstructs ordered actions and principals but finds missing integrity or retention evidence.",
    "evidence_refs": [
      "fixture://AIVSS-ASI01-001/untraceability"
    ],
    "retrieval_tested": true,
    "ordered_actions_reconstructable": true,
    "affected_principals_bounded": true,
    "required_fields_complete": false,
    "integrity_protected": false,
    "retention_verified": false
  },
  "path_id": "AIVSS-ASI01-001-PATH-1",
  "agentic_applicability": {
    "model_directed_goal_pursuit": true,
    "action_selection_or_sequencing": true,
    "rationale": "The synthetic fixture uses a model to pursue a delegated goal and select or sequence actions that affect its environment.",
    "evidence_refs": [
      "fixture://AIVSS-ASI01-001/agentic-applicability"
    ]
  },
  "publicly_exposed_source": "synthetic deployment inventory fixture",
  "decision_data_observed_at": "2026-08-27T00:00:00Z",
  "metric_evidence": {
    "LC": {
      "rationale": "Synthetic reference fact for AIVSS-ASI01-001: Attacker-supplied natural language reaches a privileged decision or tool-invocation path without mediation.",
      "evidence_refs": [
        "fixture://AIVSS-ASI01-001/lc"
      ]
    },
    "CP": {
      "rationale": "Synthetic reference fact for AIVSS-ASI01-001: Attacker-controlled context persists only in ephemeral session state (conversation buffer, in-memory working context, session-scoped cache), and testing confirms it is unreachable after the session boundary.",
      "evidence_refs": [
        "fixture://AIVSS-ASI01-001/cp"
      ]
    },
    "AP": {
      "rationale": "Synthetic reference fact for AIVSS-ASI01-001: Influence relays across agent components under the same principal and policy domain without crossing a trust boundary.",
      "evidence_refs": [
        "fixture://AIVSS-ASI01-001/ap"
      ]
    },
    "RH": {
      "rationale": "Synthetic reference fact for AIVSS-ASI01-001: Every evaluator, verifier and reward channel on the path sits outside the agent's reach (write-protected or in a separate trust domain), and a test confirms the isolation.",
      "evidence_refs": [
        "fixture://AIVSS-ASI01-001/rh"
      ],
      "reachable_proxy": false,
      "isolation_verified": true,
      "verified_episodes": null,
      "episodes_reviewed": null,
      "locus": null
    },
    "ES": {
      "rationale": "Synthetic reference fact for AIVSS-ASI01-001: Extensions are allowlisted, but material gaps remain in argument schemas, credentials or callable operations.",
      "evidence_refs": [
        "fixture://AIVSS-ASI01-001/es"
      ]
    }
  },
  "include_decision": true,
  "include_priority": false,
  "provenance": {
    "assessor": "synthetic-reference-fixture",
    "assessor_kind": "imported",
    "tool": "aivss-calc",
    "tool_version": "1.2.0",
    "assessed_at": "2026-08-27T00:00:00Z"
  }
}
